{"assets":{"agentsRouteDigest":"sha256:08ca6c0782dbc36ace6359c8fe36807810f9668d999c7d9e8ead6bf281d9bf30","assetCatalogDigest":"sha256:3ec380a1a6dd8534824ba82ff23affba993e19e9cb6b3c5e424ea9973ad686da","callerWorkflowDigest":"sha256:fdc11e7d279ba1187e642171713ed326c45d1cf35eb41d6afca20a20f134a1c5","docsScriptsDigest":"sha256:7a502ddeda5e3d0296b712b5c07e0905a9b7a8fcd374d37db8a02cb026a37881","skillDigest":"sha256:a86d8c9b990124f11b50b1c6703e1aeb5e3b981d51f7e8f5c163c4f5b987d7c5","transitionCatalogDigest":"sha256:7d7d5308e5495dc159b34aaaceaf5953e4649a1330a96065585777464d68d06c"},"callerWorkflowPath":".github/workflows/docs-protocol.yml","cohortAuthority":{"channel":"rc","eligibleAfter":"2026-09-04T00:00:00Z","qualificationEventDigest":"sha256:2222222222222222222222222222222222222222222222222222222222222222","recordDigest":"sha256:1111111111111111111111111111111111111111111111111111111111111111","rollbackTo":["docs-2026-08-v1"],"upgradeFrom":["docs-2026-08-v1"]},"cohortId":"docs-2026-09-v2","managedStatePath":"architecture/foundation/docs-protocol-managed-state.json","packages":{"docsProtocol":{"integrity":"sha512-AAAAAAAAAAAAAAAAAAAAAAAAAAAAAAAAAAAAAAAAAAAAAAAAAAAAAAAAAAAAAAAAAAAAAAAAAAAAAAAAAAAAAA==","version":"0.5.0"},"docsProtocolAgentTeams":{"integrity":"sha512-AAAAAAAAAAAAAAAAAAAAAAAAAAAAAAAAAAAAAAAAAAAAAAAAAAAAAAAAAAAAAAAAAAAAAAAAAAAAAAAAAAAAAA==","version":"0.1.0"},"documentAuthoring":{"integrity":"sha512-AAAAAAAAAAAAAAAAAAAAAAAAAAAAAAAAAAAAAAAAAAAAAAAAAAAAAAAAAAAAAAAAAAAAAAAAAAAAAAAAAAAAAA==","version":"0.1.0"},"engineeringFoundation":{"integrity":"sha512-AAAAAAAAAAAAAAAAAAAAAAAAAAAAAAAAAAAAAAAAAAAAAAAAAAAAAAAAAAAAAAAAAAAAAAAAAAAAAAAAAAAAAA==","version":"1.0.0"},"repositoryMutation":{"integrity":"sha512-AAAAAAAAAAAAAAAAAAAAAAAAAAAAAAAAAAAAAAAAAAAAAAAAAAAAAAAAAAAAAAAAAAAAAAAAAAAAAAAAAAAAAA==","version":"0.1.0"}},"profilePath":"architecture/foundation/docs-protocol.yaml","repository":{"id":"1314129620","nameWithOwner":"agent-teams-ai/agent-runtime","provider":"github"},"runtime":{"node":">=24.18.0 <25","pnpm":">=11.17.0 <12","runtimeClosureDigest":"sha256:9999999999999999999999999999999999999999999999999999999999999999"},"schemaVersion":2,"schemas":{"consumerIntegration":3,"docsProtocol":1,"managedState":2},"skillPath":".agents/skills/docs-authoring/SKILL.md","stateDigest":"sha256:2ce0ad66511ebc7953ce706c5a8822338b2bacc6c8f551f2f2b3be3dccb62a2f"}
